4901	Funcionamento do Conselho Nacional de Seguranca Alimentar e Nutricional		2038
2000	Administracao da Unidade	Administracao de unidade	2101
21155	Disseminacao de Conduta ctica no Poder Executivo Federal		2101
8699	Gerenciamento das Polcticas Pcblicas de Juventude		2044
4693	Seguranca Institucional do Presidente da Repcblica e do Vice-Presidente da Repcblica, Respectivos Familiares, e Outras Autoridades		2101
21327	Sistema de Protecao ao Programa Nuclear Brasileiro - SIPRON		2059
216024	Formulacao, Desenvolvimento e Capacitacao para Participacao Social		2038
20125	Gerenciamento das Relacaes Institucionais do Governo		2038
4912	Auditoria e Fiscalizacao nos Prestadores de Servico de Certificacao Digital e Normatizacao da ICP-Brasil		2038
4917	Operacionalizacao, Manutencao e Modernizacao da Autoridade Certificadora Raiz da Infraestrutura da ICP-Brasil		2038
20135	Fortalecimento do Sistema Pcblico de Radiodifusco e Comunicacao		2025
2675	Comunicacao e Transmissco de Atos e Fatos do Governo Federal		2101
6662	Formulacao e Desenvolvimento da Polctica de Planejamento Estratcgico de Longo Prazo		2101
4727	Diagncsticos, Prospeccaes e Estratcgias do Desenvolvimento Brasileiro		2038
8785	Gestco e Coordenacao do Programa de Aceleracao do Crescimento - PAC		2017
21014	Gestco para o Desenvolvimento da Aviacao Civil		2101
2912	Regulacao e Fiscalizacao da Aviacao Civil		2017
2674	Representacao Judicial e Extrajudicial da Unico e suas Autarquias e Fundacaes Federais		2038
21013	Atendimento cs Mulheres em Situacao de Violcncia		2016
8843	Incentivo a Polcticas de Autonomia das Mulheres		2016
21258	Controle Interno, Prevencao c Corrupcao, Ouvidoria e Correicao		2101
21034	Fomento a Acaes Afirmativas e Outras Iniciativas para o Enfrentamento ao Racismo e a Promocao da Igualdade Racial		2034
21319	Fortalecimento Institucional dos crgcos Estaduais e Municipais para o Enfrentamento ao Racismo e Promocao da Igualdade Racial		2034
6440	Fomento ao Desenvolvimento Local para Comunidades Remanescentes de Quilombos e Outras Comunidades Tradicionais		2034
2090	Fiscalizacao dos Servicos e da Exploracao da Infraestrutura do Transporte Aquavicrio		2101
2088	Concessco e Regulacao dos Servicos e da Exploracao da Infraestrutura do Transporte Aquavicrio		2101
2031	Servicos de Registro Mercantil e Atividades Afins		2023
21011	Promocao do Desenvolvimento de Micro e Pequenas Empresas		2047
8690	Fiscalizacao, Controle e Avaliacao de Imcveis da Unico		2038
20244	Gestco do Patrimcnio Imobilicrio da Unico		2038
20240	Gestco e Aprimoramento do Planejamento		2038
8861	Gestco e Aprimoramento do Processo Orcamentcrio		2038
4732	Estudos sobre Conjuntura Econcmica e Investimentos Pcblicos		2125
4743	Coordenacao e Governanca das Empresas Estatais Federais		2125
20241	Aperfeicoamento da Gestco Pcblica		2038
201920	Gestco de Assuntos Internacionais		2125
20242	Gestco e Aprimoramento dos Recursos de Tecnologia da Informacao e de Logcstica do Servico Pcblico Federal		2038
201215	Cadastro Nacional de Enderecos para Fins Estatcsticos		2038
20246	Pesquisas e Estudos Estatcsticos		2038
20248	Pesquisas, Estudos e Levantamentos Geocientcficos		2038
20245	Ensino de Graduacao e Pcs-Graduacao em Estatcsticas e Geocicncias		2032
20249	Desenvolvimento de Competcncias de Agentes Pcblicos, Pesquisa e Disseminacao de Conhecimento em Gestco Pcblica		2038
202221	Fiscalizacao de Atividades Agropecucrias		2028
202226	Promocao da Defesa Agropecucria		2028
202223	Desenvolvimento das Regices Produtoras de Cacau		2042
2161	Producao e Divulgacao de Informacaes Meteorolcgicas e Climatolcgicas	Producao e Divulgacao de Informacaes Meteorolcgicas e Climatolcgicas	2014
8606	Apoio ao Desenvolvimento e Controle da Agricultura Orgcnica - Prc-Orgcnico	Acaes voltadas para: educacao em agroecoelogia e sistemas orgcnicos de producao; fomento ao uso de produtos e processos na agricultura orgcnica; organizacao das redes de producao orgcnica e promocao.	2014
8593	Apoio ao Desenvolvimento de Agricultura de Baixa Emissco de Carbono - ABC	Apoio a praticas sustentcveis( manejo de solo e cgua) na agropecucria	2014
202235	Fomento ao Setor Agropecucrio		2014
202236	Promocao do Agronegccio Brasileiro no Mercado Internacional		2014
20236	Pesquisa e Desenvolvimento de Tecnologias para a Agropecucria		2042
8924	Transfercncia de Tecnologias Desenvolvidas para a Agropecucria	Transfercncia de Tecnologia para o Desenvolvimento do Agronegccio	2042
202224	Reducao de Riscos na Atividade Agropecucria		2014
20237	Desenvolvimento do Abastecimento Agroalimentar		2014
2792	Distribuicao de Alimentos a Grupos Populacionais Especcficos	Distribuicao de Alimentos	2069
2798	Aquisicao de Alimentos Provenientes da Agricultura Familiar	PAA	2069
2137	Fiscalizacao dos Estoques e das Operacaes de Garantia e Sustentacao de Precos na Comercializacao de Produtos Agropecucrios	Fiscalizacao dos estoques pcblicos e das operacaes de escoamento da producao	2014
15127	Ampliacao e Melhoria da Capacidade Armazenadora da CONAB		2014
20238	Desenvolvimento da Cafeicultura		2014
2495	Controle de Bens Senscveis		2106
21328	Funcionamento da Comissco Tccnica Nacional de Biosseguranca		2106
21329	Funcionamento do Conselho Nacional de Controle de Experimentacao Animal - CONCEA		2106
202420	Cicncia, Tecnologia e Inovacao no Instituto Nacional de Tecnologia - INT		2021
487	Concessco de Bolsas de Estudos no Ensino Superior	Bolsas de Estudos no Pacs	2032
202430	Cicncia, Tecnologia e Inovacao no Instituto Nacional de Pesquisas da Amazcnia - INPA		2021
202435	Cicncia, Tecnologia e Inovacao no Instituto Nacional de Pesquisas Espaciais - INPE		2021
203515	Apoio a Projetos de Pesquisa e Desenvolvimento Relacionados cs Mudancas Climcticas		2050
202422	Desenvolvimento, Manutencao e Atualizacao da Infraestrutura Espacial		2056
203513	Pesquisa e Desenvolvimento de Tecnologias para o Setor Espacial		2056
203511	Desenvolvimento e Lancamento de Satclites		2056
202431	Cicncia, Tecnologia e Inovacao no Centro Brasileiro de Pesquisas Fcsicas - CBPF		2021
4132	Pesquisa e Desenvolvimento no Instituto Brasileiro de Informacao em Cicncia e Tecnologia - IBICT		2021
202427	Cicncia, Tecnologia e Inovacao no Museu de Astronomia e Cicncias Afins - MAST		2021
202429	Cicncia, Tecnologia e Inovacao no Observatcrio Nacional - ON		2021
4128	Pesquisa e Desenvolvimento no Centro de Tecnologia Mineral - CETEM		2021
4126	Pesquisa e Desenvolvimento em Astrofcsica e Astronomia no Laboratcrio Nacional de Astrofcsica - LNA		2021
121913	Implantacao do Centro Nacional de Monitoramento e Alerta de Desastres Naturais - CEMADEN		2040
1835	Formacao, Capacitacao e Fixacao de Recursos Humanos Qualificados para C,T&I		2021
202426	Seguranca Nuclear e Controle de Material Nuclear e Protecao Fcsica de Instalacaes Nucleares e Radiativas		2059
2468	Atendimento a Emergcncias Radiolcgicas e Nucleares		2059
2478	Fornecimento de Radioisctopos e Radiofcrmacos no Pacs		2059
202423	Radioprotecao, Dosimetria e Metrologia das Radiacaes Ionizantes		2059
202421	Desenvolvimento da Cicncia e da Tecnologia Nuclear		2059
12171	Implantacao do Reator Multipropcsito Brasileiro		2059
2482	Fabricacao do Combustcvel Nuclear		2059
2489	Producao de Minerais Pesados e cxidos de Terras Raras		2041
20351	Desenvolvimento e Fabricacao de Equipamentos para as Indcstrias Nuclear e Pesada de Alta Tecnologia		2055
6432	Pesquisa, Desenvolvimento, Fabricacao e Comercializacao de Componentes Semicondutores		2055
20228	Acompanhamento e Controle de Atividades Econcmicas		2039
20226	Gestco de Polcticas Econcmicas e Fiscais		2039
2244	Recuperacao de crcditos, consultoria, representacao judicial e extrajudicial da Fazenda Nacional		2110
203514	Fortalecimento Institucional		2110
2237	Auditoria e Fiscalizacao Tributcria e Aduaneira		2110
2238	Arrecadacao Tributcria e Aduaneira		2110
202624	Desenvolvimento do Mercado de Valores Mobilicrios		2039
21028	Supervisco do Mercado de Valores Mobilicrios		2039
2211	Solucaes de Tecnologia da Informacao para o Governo Federal		751
203534	Fiscalizacao e Regulamentacao de Mercados de Seguros, Resseguros, Capitalizacao e Previdcncia Complementar Aberta		2039
2250	Selecao, Formacao e Desenvolvimento de Pessoas		2038
4572	Capacitacao de Servidores Pcblicos Federais em Processo de Qualificacao e Requalificacao	Capacitacao de Servidores	2109
2030	Manutencao das Polccias Civil e Militar e do Corpo de Bombeiros do Distrito Federal		903
203034	Gerenciamento das Polcticas de Educacao		2109
203024	Gestco Educacional e Articulacao com os Sistemas de Ensino		2030
6344	Regulacao e Supervisco dos Cursos de Graduacao e de Instituicaes Pcblicas e Privadas de Ensino Superior		2032
203035	Funcionamento das Instituicaes Federais de Educacao Bcsica		2030
203029	Funcionamento de Instituicaes Federais de Ensino Superior		2032
203028	Apoio c Capacitacao e Formacao Inicial e Continuada para a Educacao Bcsica		2030
20309	Prevencao de Uso e/ou Abuso de Drogas		2060
203329	Fomento cs Acaes de Graduacao, Pcs-Graduacao, Ensino, Pesquisa e Extensco		2032
8282	Reestruturacao e Expansco de Instituicaes Federais de Ensino Superior		2032
142120	Implantacao da Universidade Federal do Oeste da Bahia - UFOB		2032
142119	Implantacao da Universidade Federal do Sul da Bahia - UFESBA		2032
4002	Assistcncia ao Estudante de Ensino Superior		2032
203018	Funcionamento de Instituicaes Federais de Educacao Profissional e Tecnolcgica	PRONATEC	2031
203026	Apoio c Formacao Profissional, Cientcfica e Tecnolcgica	PRONATEC	2031
8585	Atencao c Sacde da Populacao para Procedimentos em Mcdia e Alta Complexidade	TETO MAC	2015
11331	Implantacao da Universidade Federal da Integracao Latino-Americana - UNILA		2032
202331	Ampliacao das Prcticas de Gestco Participativa, de Controle Social, de Educacao Popular em Sacde e Implementacao de Polcticas de Promocao da Equidade		2015
8871	Apoio c Elaboracao e Monitoramento de Planos de Saneamento Regionais e Nacional		2068
6516	Aperfeicoamento e Avaliacao dos Servicos de Hemoterapia e Hematologia	Sangue	2015
21036	Promocao da Educacao do Campo		2066
203020	Avaliacao da Educacao Superior e da Pcs-Graduacao		2032
6503	Censo da Educacao Superior		2032
203031	Exames e Avaliacaes da Educacao Bcsica		2030
4014	Censo Escolar da Educacao Bcsica	Censo Escolar	2030
4000	Estudos e Pesquisas Educacionais e Socioeducativas		2109
6294	Promocao de Cursos para o Desenvolvimento Local Sustentcvel		2109
4086	Funcionamento e Gestco de Instituicaes Hospitalares Federais		2032
6380	Fomento ao Desenvolvimento da Educacao Profissional e Tecnolcgica	PRONATEC	2031
6358	Capacitacao de Recursos Humanos da Educacao Profissional e Tecnolcgica	PRONATEC	2031
21020	Promocao e Defesa dos Direitos da Pessoa com Deficicncia		2063
20230	Fomento c Producao Pesqueira e Aquccola		2052
11330	Implantacao da Universidade Federal do Oeste do Parc - UFOPA		2032
142127	Implantacao da Universidade Federal do Sul e Sudeste do Parc - UNIFESSPA		2032
142117	Implantacao da Universidade Federal do Cariri - UFCA		2032
2692	Fiscalizacao do Cumprimento de Contrapartidas Produtivas Exigidas pelos Regimes Especiais Regulamentados no Contexto da Polctica Industrial		2055
2022	Anclise de Processos contra Prcticas Desleais e Ilegais		2024
202227	Promocao e Gestco do Comcrcio Exterior		2024
509	Apoio ao Desenvolvimento da Educacao Bcsica	Promed	2030
203635	Servicos de Metrologia e Qualidade Industrial		2055
151529	Implantacao de Unidades da Defensoria Pcblica da Unico		2020
2725	Prestacao de Assistcncia Jurcdica ao Cidadco		2020
20357	Polctica Nacional de Justica		2020
8974	Democratizacao do Acesso c Cidadania e c Justica		2020
203516	Polctica Pcblica sobre Drogas		2060
72423	Implementacao do Plano Nacional de Seguranca Pcblica para a Realizacao dos Grandes Eventos		2070
2334	Protecao e Defesa do Consumidor		2020
2810	Preservacao do Patrimcnio Arquivcstico Nacional		2020
2723	Policiamento Ostensivo nas Rodovias e Estradas Federais		2070
86151	Processamento e Arrecadacao de Multas Aplicadas pela Polccia Rodovicria Federal		2070
2726	Prevencao e Repressco ao Trcfico Ilccito de Drogas e a Crimes Praticados contra Bens, Servicos e Interesses da Unico		2070
202414	Fiscalizacao e Demarcacao de Terras Indcgenas, Localizacao e Protecao de cndios Isolados e de Recente Contato		2065
2384	Promocao do Desenvolvimento Sustentcvel dos Povos Indcgenas		2065
151130	Realizacao da 1c Confercncia Nacional de Polctica Indigenista		2112
8635	Preservacao Cultural dos Povos Indcgenas		2065
1151320	PROJETO COMUNIDADE INDIGENA GUARANI/BR101 c DNIT		151
1151121	PROGRAMA DE COMPENSACAO COMPLEXO JURUENA		151
1151123	PROJETO INDIOS ISOLADOS BR-429 c RO		151
2807	Promocao e Defesa da Concorrcncia		2020
6067	Defesa dos Direitos Difusos		2020
202625	Consolidacao do Sistema Penitencicrio Federal		2070
202433	Reintegracao Social, Alternativas Penais e Controle Social		2070
202434	Gestco do Sistema Criminal e Penitencicrio		2070
4897	Planejamento do Setor Energctico		2119
4887	Estudos para o Planejamento dos Setores de Geologia, Mineracao e Transformacao Mineral		2119
1379	Atendimento das Demandas por Energia Elctrica em Localidades Isoladas Nco-Supridas pela Rede Elctrica Convencional		2033
20186	Coordenacao das Acaes de Integracao Elctrica com os Pacses Vizinhos		2033
20187	Monitoramento da Expansco e do Desempenho dos Sistemas Elctricos em Apoio ao CMSE		2033
4892	Planejamento dos Setores de Petrcleo, Derivados, Gcs Natural e Combustcveis Renovcveis		2119
103636	Monitoramento da Recuperacao Ambiental da Bacia Carboncfera de Santa Catarina		2067
21228	Regulacao da Distribuicao e Revenda de Derivados de Petrcleo, Gcs Natural e Biocombustcveis		2022
21229	Regulacao da Exploracao, Desenvolvimento e Producao de Petrcleo e Gcs Natural		2053
202636	Fiscalizacao das Atividades Minercrias		2041
203622	Desenvolvimento Sustentcvel da Pequena Mineracao		2041
2377	Gestco da Emissco, Manutencao e Extincao de Direitos Minercrios		2041
4880	Fiscalizacao dos Servicos de Energia Elctrica		2033
4699	Outorga de Geracao, Transmissco e Distribuicao de Energia Elctrica		2033
4703	Regulamentacao dos Servicos de Energia Elctrica		2033
2993	Ouvidoria Setorial da Agcncia Nacional de Energia Elctrica		2033
21142	Participacao Pcblica na Agenda Regulatcria do Setor Elctrico		2033
2015	Funcionamento do Conselho de Recursos da Previdcncia Social		2061
2276	Auditoria nos Regimes Prcprios dos Servidores Pcblicos		2061
203419	Sustentabilidade e Fomento aos Regimes Pcblico e Geral da Previdcncia Social		2061
21225	Sustentabilidade e Fomento do Regime de Previdcncia Complementar		2061
2589	Avaliacao e Operacionalizacao do Benefccio de Prestacao Continuada da Assistcncia Social (BPC) e Manutencao da Renda Mensal Vitalccia (RMV)	BPC	2037
2591	Reconhecimento de Direitos de Benefccios Previdencicrios		2061
2593	Funcionamento das Unidades Descentralizadas da Previdcncia Social		2061
2294	Defesa Judicial da Previdcncia Social Bcsica		2061
2585	Servico de Reabilitacao Profissional		2061
2563	Gestco da Melhoria Contcnua		2061
203320	Educacao Previdencicria e Financeira		2061
203436	Sistema Nacional de Informacaes de Registro Civil - SIRC		2061
2562	Auditoria Preventiva e Corretiva em Rotinas, Procedimentos e Processos		2061
203430	Gestco da Informacao Corporativa na Previdcncia Social		2061
21026	Apoio c Organizacao Econcmica e Promocao da Cidadania de Mulheres Rurais		2012
2592	Fiscalizacao das Entidades de Previdcncia Complementar		2061
2367	Anclise e Divulgacao da Polctica Externa Brasileira, de Relacaes Internacionais e da Histcria Diplomctica do Brasil		2057
8315	Pesquisa e Desenvolvimento Tecnolcgico em Sacde		2015
7674	Modernizacao de Unidades de Sacde da Fundacao Oswaldo Cruz	FIOCRUZ	2055
6179	Comunicacao e Informacaes para a Educacao em Sacde e em Cicncia e Tecnologia	Educacao em Sacde	2015
8327	Servico Laboratorial de Refercncia para o Controle de Doencas	Laboratcrio	2015
202316	Imunobiolcgicos e Insumos para Prevencao e Controle de Doencas		2015
6174	Anclise da Qualidade de Produtos e Insumos de Sacde		2015
202312	Educacao e Formacao em Sacde		2015
20197	Manutencao do Patrimcnio Histcrico e Cultural de Cicncia e da Sacde na Fiocruz		2015
20198	Apoio c Implantacao e Manutencao dos Sistemas de Saneamento Bcsico e Acaes de Sacde Ambiental		2115
20366	Fortalecimento da Sacde Ambiental para Reducao dos Riscos c Sacde Humana		2015
201533	Apoio c Gestco dos Sistemas de Saneamento Bcsico em Municcpios de atc 50.000 Habitantes	Saneamento Bcsico	2068
6908	Fomento c Educacao em Sacde voltada para o Saneamento Ambiental para Prevencao e Controle de Doencas e Agravos		2068
6138	Vigilcncia Sanitcria em Portos, Aeroportos, Fronteiras e Recintos Alfandegados		2015
8719	Vigilcncia Sanitcria de Produtos, Servicos e Ambientes, Tecidos, Cclulas e crgcos Humanos	Vigilcncia Sanitcria	2015
4339	Qualificacao da Regulacao e Fiscalizacao da Sacde Suplementar		2015
201933	Atuacao Internacional do Ministcrio da Sacde		2015
8648	Desenvolvimento e Fortalecimento da Economia da Sacde para o Aperfeicoamento do SUS	Economia da Sacde	2015
8753	Monitoramento e Avaliacao da Gestco do SUS	Avaliacao da Gestco SUS	2015
202319	Apoio Institucional para Aprimoramento do SUS		2115
2016	Funcionamento do Conselho Nacional de Sacde	CNS	2015
8287	Aprimoramento da Articulacao e Cooperacao Interfederativa e da Gestco Compartilhada do SUS	Gestco Descentralizada	2015
8708	Auditoria do Sistema cnico de Sacde	Auditoria	2015
202320	Sistemas de Tecnologia de Informacao e Comunicacao para a Sacde (e-Saude)		2015
6182	Ouvidoria Nacional de Sacde	Ouvidoria	2015
21352	Desenvolvimento Institucional da Gestco Orcamentcria, Financeira e Contcbil do Fundo Nacional de Sacde e dos Fundos Estaduais e Municipais de Sacde	Apoio aos Fundos de Sacde	2015
8758	Aperfeicoamento, Avaliacao e Desenvolvimento de Acaes e Servicos Especializados em Oncologia - INCa	INCA	2015
201914	Pesquisas, Ensino e Inovacaes Tecnolcgicas Biomcdicas e em Medicina Tropical e Meio Ambiente		2015
202317	Promocao, Protecao e Recuperacao da Sacde Indcgena		2065
202324	Fiscalizacao de Obrigacaes Trabalhistas e Inspecao em Seguranca e Sacde no Trabalho		2071
202335	Democratizacao das Relacaes de Trabalho		2071
4815	Funcionamento das Unidades Descentralizadas		2127
20223	Apoio Operacional ao Pagamento do Seguro-Desemprego e do Abono Salarial		2071
202326	Producao e Difusco de Conhecimentos para a Promocao de Polcticas Pcblicas em Seguranca e Sacde no Trabalho		2071
21143	Gestco Participativa do Fundo de Amparo ao Trabalhador - FAT		2071
2553	Identificacao da Populacao por meio da Carteira de Trabalho e Previdcncia Social - CTPS		2071
93521	Cumprimento de Obrigacaes decorrentes da extincao da Rede Ferrovicria Federal S/A - RFFSA		2126
202411	Estudos, Projetos e Planejamento de Infraestrutura de Transportes		2126
2348	Fiscalizacao da Exploracao da Infraestrutura Ferrovicria		2072
202413	Fiscalizacao dos Servicos de Transporte Rodovicrio		2075
4349	Administracao das Hidrovias		2126
86935	Manutencao e Gestco dos Ativos Ferrovicrios		2126
2424	Fiscalizacao em Telecomunicacaes		2025
202212	Regulacao dos Servicos de Telecomunicacaes		2025
202214	Promocao e Fomento c Cultura Brasileira		2027
202233	Formulacao e Gestco da Polctica Cultural		2027
14242	Implantacao, Instalacao e Modernizacao de Espacos e Equipamentos Culturais		2027
202234	Preservacao do Patrimcnio Cultural Brasileiro		2027
203523	Apoio c Implemetacao da Polctica Nacional de Educacao Ambiental		2045
20318	Implementacao do Plano Nacional de Producao e Consumo Sustentcveis (PPCS)		2050
202615	Desenvolvimento Florestal Sustentcvel e Manejo Florestal Comunitcrio Familiar		2036
202613	Pesquisa e Informacaes Florestais		2036
202612	Inventcrio Florestal Nacional		2036
202616	Fiscalizacao dos Recursos da Biodiversidade		2018
6307	Fiscalizacao de Atividades de Desmatamento		2036
6124	Fiscalizacao de Atividades Degradadoras, Poluentes e Contaminantes		2045
202633	Estruturacao da Gestco Nacional dos Recursos Fauncsticos		2018
6074	Prevencao e Combate a Inccndios Florestais e Controle de Queimadas		2036
8294	Estruturacao dos crgcos do Sistema Nacional de Meio Ambiente para a Gestco Florestal Compartilhada		2036
8296	Autorizacao e Controle das Atividades Florestais		2036
203131	Promocao de Acaes de Gestco de Riscos, Preparacao e Atendimento a Emergcncias Ambientais		2045
202634	Avaliacao de Periculosidade e Controle de Produtos, Substcncias Qucmicas e Rescduos Perigosos		2045
6925	Licenciamento Ambiental Federal		2045
6037	Fortalecimento e Aprimoramento da Fiscalizacao Ambiental		2036
8286	Educacao Ambiental para Grupos em Situacao de Vulnerabilidade Socioambiental		2045
202614	Avaliacao dos Estoques e do Potencial Sustentcvel dos Recursos Pesqueiros		2018
4969	Controle, Monitoramento, Triagem, Recuperacao e Destinacao de Animais Silvestres		2018
21230	Avaliacao das Medidas de Ordenamento do Uso de Recursos Pesqueiros		2018
202635	Implementacao da Polctica Nacional de Recursos Hcdricos		2026
2378	Operacao da Rede Hidrometeorolcgica		2026
4926	Regulacao e Fiscalizacao dos Usos de Recursos Hcdricos, dos Servicos de Irrigacao e Aducao de cgua Bruta e da Seguranca de Barragens		2026
202618	Protecao e Ampliacao de Colecaes Vivas em Jardins Botcnicos		2018
202629	Pesquisa, Avaliacao e Monitoramento da Flora Brasileira		2018
202627	Fiscalizacao Ambiental em Unidades de Conservacao		2018
202631	Apoio c Criacao, Gestco e Implementacao das Unidades de Conservacao Federais		2018
202620	Execucao de Pesquisa e Conservacao de Espccies e Patrimcnio Espeleolcgico		2018
6381	Consolidacao Territorial das Unidades de Conservacao Federais		2018
8499	Apoio a Projetos de Gestco Integrada do Meio Ambiente (PNMA II)		2045
203123	Prevencao e Combate a Inccndios Florestais em Unidades de Conservacao Federais		2036
21111	Regularizacao da Estrutura Fundicria na crea de Abrangcncia da Lei 11.952, de 2009		2066
21024	Organizacao da Estrutura Fundicria		2066
21022	Reconhecimento e Indenizacao de Territcrios Quilombolas		2034
21115	Desenvolvimento de Assentamentos Rurais		2066
21030	Assistcncia Social e Pacificacao no Campo		2066
21025	Assistcncia Tccnica e Extensco Rural para Reforma Agrcria		2012
2105	Gerenciamento e Fiscalizacao do Cadastro Rural	Cadastro Rural	2066
21122	Implementacao e Desenvolvimento da Polctica Nacional de Controle de Dopagem		2035
1151727	ESTRUTURACAO E MANUTENCAO DA AUTORIDADE PUBLICA OLIMPICA		6102
2055	Cursos de Altos Estudos da Escola Superior de Guerra		2108
20364	Manutencao do Sistema Militar de Catalogacao		2055
20216	Desenvolvimento Sustentcvel da Regico do Calha Norte		2058
2872	Mobilizacao para o Servico Militar Obrigatcrio		2058
142523	Apoio c Realizacao de Grandes Eventos		2058
20213	Mobilizacao e Logcstica para a Defesa Nacional		2058
20217	Emprego Conjunto ou Combinado das Forcas Armadas		2058
2866	Acaes de Carcter Sigiloso		2108
20211	Participacao Brasileira em Missces de Paz		2057
21255	Interccmbio e Cooperacao Internacional na crea de Defesa		2058
203533	Apoio das Forcas Armadas ao Desenvolvimento do Desporto Militar e ao Esporte Nacional		2058
6557	Formacao Ccvico-Profissional de Jovens em Servico Militar - Soldado Cidadco		2058
8425	Apoio ao Projeto Rondon		2058
20215	Comando e Controle de Defesa Nacional		2058
20214	Manutencao do Sistema de Protecao da Amazcnia - SIPAM		2058
2913	Investigacao e Prevencao de Acidentes Aeroncuticos		2058
202135	Operacao do Sistema de Controle do Espaco Acreo Brasileiro - SISCEAB		2058
202115	Aprestamento da Aeroncutica		2058
20218	Graduacao e Pcs-Graduacao do Instituto Tecnolcgico de Aeroncutica - ITA		2058
20350	Desenvolvimento e Lancamento de Foguetes Suborbitais e de Vecculos Lancadores de Satclites		2056
2916	Instrucao e Treinamento Tccnico-Operacional da Aeroncutica		2058
202112	Apoio das Forcas Armadas c Populacao		2058
2911	Aquisicao e Modernizacao dos Meios de Engenharia do Excrcito		2058
1248	Construcao de Trecho Rodovicrio - Manaus - Divisa AM/RO - na BR-319/AM		2075
15620	Obtencao de Meios do Excrcito		2058
221327	Acaes de Defesa Civil		2040
4450	Aprestamento do Excrcito		2058
202116	Manutencao dos Sistemas de Comando e Controle do Excrcito		2058
2004	Assistcncia Mcdica e Odontolcgica aos Servidores Civis, Empregados, Militares e seus Dependentes	Assistcncia Mcdica e Odontolcgica	2108
203529	Manutencao de Trechos Rodovicrios na Regico Norte		2075
8965	Capacitacao Profissional Militar do Excrcito Brasileiro		2058
202129	Logcstica Militar Terrestre		2058
15631	Modernizacao Operacional do Excrcito Brasileiro		2058
201723	Adequacao de Organizacaes Militares do Excrcito		2058
2919	Registro e Fiscalizacao de Produtos Controlados		2058
2900	Selecao para o Servico Militar e Apresentacao da Reserva em Disponibilidade		2058
143526	Apoio Logcstico cs Forcas de Seguranca Pcblica do Estado do Rio de Janeiro		2058
202131	Ensino Assistencial nos Colcgios Militares		2108
3138	Implantacao do Sistema de Aviacao do Excrcito		2058
14714	Implantacao de Sistema de Defesa Cibernctica para a Defesa Nacional		2058
202128	Desenvolvimento Tecnolcgico do Excrcito		2058
131213	Aquisicao de Sistemas de Artilharia Antiacrea		2058
141826	Implantacao do Sistema de Defesa Estratcgico ASTROS 2020		2058
14364	Aquisicao de Blindados Guarani		2058
202134	Acaes de Cooperacao do Excrcito		2058
14365	Implantacao do Sistema Integrado de Monitoramento de Fronteiras - SISFRON		2058
11019	Adequacao de Trecho Rodovicrio - Pedra Branca - Divisa SE/AL - na BR-101/SE		2075
203528	Manutencao de Trechos Rodovicrios na Regico Nordeste		2075
7624	Adequacao de Trecho Rodovicrio - Divisa AL/PE - Divisa AL/SE - na BR-101/AL		2075
203531	Manutencao de Trechos Rodovicrios na Regico Sul		2075
2345	Missco Antcrtica		2046
202120	Aprestamento da Marinha		2058
12333	Implantacao de Estaleiro e Base Naval para Construcao e Manutencao de Submarinos Convencionais e Nucleares		2058
12334	Construcao de Submarino de Propulsco Nuclear		2058
12335	Construcao de Submarinos Convencionais		2058
14367	Tecnologia Nuclear da Marinha		2058
2510	Ensino Profissional Marctimo		2058
